File Path;Name;Description
/SodaCan_289.png;Mystic Totem Vessel;Ancient wisdom locked in art.
/SodaCan_290.png;Mystic Mandala Toad;Intricate totem of prosperity and mystique.
/SodaCan_291.png;Mystic Gaze Canister 2;Enchanted eyes within intricate patterns.
/SodaCan_292.png;Mystic Chroma Toad;Enigmatic toad guardian of a surreal, floral realm.
/SodaCan_293.png;Mystic Mountain Toad 1;Enchanted toad guards mystical peaks, blooms eternal spring.
/SodaCan_294.png;Mystic Totem Gaze;Enigmatic guardian of digital realms.
/SodaCan_295.png;Mystic Toad Majesty;A vivid toad reigns over his surreal mountain realm.
/SodaCan_296.png;Mystic Mountain Gecko;A vibrant gecko's magical habitat.
/SodaCan_297.png;Mystic Mountain Toad 2;Enigmatic toad guardian amidst alpine blooms.
/SodaCan_298.png;Mystical Can Guardian;A vivid guardian frog overseeing mystical flora under twilight peaks.
/SodaCan_299.png;Mystical Mountain Hopper;Enchanted frog reigns over a vibrant flora kingdom.
/SodaCan_300.png;Mystic Serpent Sip;Enchanting serpent guardian of mythic brews.
/SodaCan_301.png;Mystic Mountain Toad 3;Enigmatic toad guardian of alpine blooms.
/SodaCan_302.png;Cosmic Swirl Can 1;Ethereal nebula hues trapped in a can.
/SodaCan_303.png;Cosmic Swirl Can 2;A mesmerizing cosmic dance encapsulated in aluminum.
/SodaCan_304.png;Cosmic Brew Vortex 1;Unleash the galaxy with a sip.
/SodaCan_305.png;Cosmic Brew Vortex 2;Sip the swirling galaxy.
/SodaCan_306.png;Cosmic Swirl Can 3;Interstellar liquid art.
/SodaCan_307.png;Cosmic Swirl Can 4;Interstellar dreams captured in a cosmic beverage.
/SodaCan_308.png;Cosmic Brew Vortex 3;A mesmerizing psychedelic swirl captures cosmic wonder in a can.
/SodaCan_309.png;Cosmic Brew Vortex 4;A surreal cosmic infusion, captured in an ethereal can.
/SodaCan_310.png;Cosmic Swirl Beverage;Sip the universe - a can of cosmic wonder.
/SodaCan_311.png;Cosmic Brew Essence;A can swirling with a vibrant, star-infused cosmic potion.
/SodaCan_312.png;Cosmic Swirl Can 5;An ethereal drink vessel, swirling with vibrant, interstellar colors.
/SodaCan_313.png;Cosmic Swirl Can 6;A vibrant dance of galactic hues.
/SodaCan_314.png;Cosmic Liquid Art;Swirling nebulas captured in a vibrant beverage can.
/SodaCan_315.png;Cosmic Swirl Canister 1;A vibrant vortex of cosmic hues captured in one mesmerizing can.
/SodaCan_316.png;Cosmic Beverage Vortex;Swirling nebula hues captured in a can, embodying the vibrant pulse of the cosmos.
/SodaCan_317.png;Cosmic Swirl Canister 2;A vortex of vibrant hues captured on timeless aluminum.
/SodaCan_318.png;Cosmic Swirl Soda;A mesmerizing interstellar beverage can, swirling with vibrant cosmic energy.
/SodaCan_319.png;Ferocious Fizz Fiend 1;Unleash the vibrant beast within, one sip at a time.
/SodaCan_320.png;Voracious Fizz Fiend;A monstrous can's thirsty grin.
/SodaCan_321.png;Monstrous Thirst Quencher 1;An effervescent terror encapsulated in a can!
/SodaCan_322.png;Cosmic Swirl Can 7;A kaleidoscopic vortex captured on metal.
/SodaCan_323.png;Cosmic Swirl Can 8;A drink can canvassing the vibrant dance of a galactic nebula.
/SodaCan_324.png;Psychedelic Tincture Twirl;Vivid swirls capture a cosmic dance in a can.
/SodaCan_325.png;Cosmic Brew Vortex 5;A can swirling with vibrant, galactic essence.
/SodaCan_326.png;Ferocious Thirst Quencher 1;Unleash the beast within with every sip from this wildly designed can.
/SodaCan_327.png;Serpentine Sip Fury;A vibrant, beast-wrapped beverage.
/SodaCan_328.png;Draconic Elixir Fury;Ferocious dragon essence captured in a can.
/SodaCan_329.png;Cyber-Totem Serpent;Electric mythos captured in a can.
/SodaCan_330.png;Jurassic Brew Fury;A primal roar in a can.
/SodaCan_331.png;Ferocious Thirst Quencher 2;A daring drink imbued with primal roar.
/SodaCan_332.png;Jurassic Thirst Quencher 1;Prehistoric refreshment, unleashed!
/SodaCan_333.png;Spectral Thirst Howler;An otherworldly can, thirsting for a sip.
/SodaCan_334.png;Ferocious Fizz Fury 1;Thirst-quenching terror unleashed.
/SodaCan_335.png;Ferocious Fizz Guardian 1;A vibrant can unleashes its mythical beast, guarding mystical brews within.
/SodaCan_336.png;Eldritch Brew Beast;The can's monstrous magic intrigues.
/SodaCan_337.png;Carnivorous Can Carnival;Unleash the beast within this ferociously vibrant vessel.
/SodaCan_338.png;Neon Monster Quencher;Eerie can with a vivacious, monstrous twist.
/SodaCan_339.png;Feral Fizz Fiend 1;A vibrant, monstrous can oozing with untamed energy.
/SodaCan_340.png;Ferocious Fizz Fiend 2;A can's monstrous thirst-trap.
/SodaCan_341.png;Primal Scream Canister;Ferocious street-art dino unleashes urban roar.
/SodaCan_342.png;Feral Canvortex;A vivid can where art roars alive.
/SodaCan_343.png;Carnivorous Can Monster;Ferocious thirst-quencher unleashed.
/SodaCan_344.png;Ferocious Fizz Fiend 3;Thirst-quenching terror unleashed!
/SodaCan_345.png;Ferocious Thirst Quencher 3;A vibrant beast guards liquid energy.
/SodaCan_346.png;Ferocious Can Monster;A vibrant can unleashing a beast!
/SodaCan_347.png;Cosmic Serpent Quench;A vibrant beast thirsting across galaxies.
/SodaCan_348.png;Ferocious Fizz Fury 2;Unleashed beast snarls from soda can.
/SodaCan_349.png;Neon Rex Roar;Vibrant prehistoric growl encapsulated.
/SodaCan_350.png;Ferocious Fizz Fiend 4;Unleash the beast with an effervescent growl.
/SodaCan_351.png;Infernal Thirst Quencher;Fierce, fiery refreshment incarnate.
/SodaCan_352.png;Ferocious Fizz Fury 3;A monstrous thirst-quencher!
/SodaCan_353.png;Aqua Canvased Odyssey;Vibrant underwater ballet in aluminum.
/SodaCan_354.png;Abyssal Harmony Can 1;Underwater dreamscape encapsulated.
/SodaCan_355.png;Aquatic Canvass Symphony;A vibrant underwater world encapsulated in aluminum artistry.
/SodaCan_356.png;Ferocious Thirst Quencher 4;Unleash the beastly sip!
/SodaCan_357.png;Aquafloral Serenade;Enigmatic dance of oceanic flora and fauna.
/SodaCan_358.png;Abyssal Harmony Can 2;Vivid marine life captured in a can.
/SodaCan_359.png;Abyssal Echoes Can;Vibrant marine life encased in a mystical can.
/SodaCan_360.png;Cosmic Chaos Can;Fantastical beasts in a vibrant cosmic dance.
/SodaCan_361.png;Abyssal Sip Serpent;Unleash the monster within, one gulp at a time.
/SodaCan_362.png;Fantastical Fizz Fiend;A vibrant, monstrous effervescence leaps from beyond the aluminum abyss.
/SodaCan_363.png;Abyssal Thirst Quencher 1;Sip on whimsy: unleash sea-creature chaos.
/SodaCan_364.png;Ferocious Thirst Quencher 5;A can alive with wild, thirst-ravenous beast!
/SodaCan_365.png;Abyssal Thirst Quencher 2;Mythical sea-beast's aquatic eruption.
/SodaCan_366.png;Cansaurus Monstrum Elixir;Beverage of Beasts, unleashed flavor frenzy!
/SodaCan_367.png;Ferocious Thirst Quencher 6;Unleash the beast within this vibrant, monstrous beverage.
/SodaCan_368.png;Abyssal Brew Horror;A monstrous, colorful can with a gaping maw.
/SodaCan_369.png;Soda Monster Abyss;An abyssal creature disguised as a fizzy temptation.
/SodaCan_370.png;Guzzling Gargoyle Gulp;Thirst-quenching terror in a can.
/SodaCan_371.png;Ferocious Fizz Fury 4;Beastly beverage erupts in a can!
/SodaCan_372.png;Chromatic Monster Maw;A carnivalesque canister of vibrant, voracious monstrosity.
/SodaCan_373.png;Abyssal Harmony Can 3;Whimsical marine life encased in aluminum.
/SodaCan_374.png;Mystic Beast Canister;A can transformed into a mythical creature's maw, entwining serpents lurk within.
/SodaCan_375.png;Aqua Can Odyssey;Vibrant marine life encapsulated in artful serenity.
/SodaCan_376.png;Aquatic Canopy Cosmos;Dive into a vibrant underwater odyssey encapsulated in a mystical can.
/SodaCan_377.png;Psychedelic Caniverse;A vibrant abyss of whimsical creatures, encapsulated in a can.
/SodaCan_378.png;Abyssal Brew Havoc;Chaos swirls in a can, a vibrant abyss awakens.
/SodaCan_379.png;Chromatic Kraken Can;Whimsical oceanic aberration unleashed.
/SodaCan_380.png;Psychedelic Soda Swamp;A vivid abyss of fantastical creatures swirling in chromatic harmony.
/SodaCan_381.png;Surreal Swirl Menagerie;A vivid fantasy of chaos and color captured in a can.
/SodaCan_382.png;Cosmic Beast Brew;A vibrant can of untamed mythical madness.
/SodaCan_383.png;Whimsical Chaos Brew;A psychedelic swirl of vivid fantasy.
/SodaCan_384.png;Chaos in Can;A vibrant pandemonium captured in aluminum.
/SodaCan_385.png;Psychedelic Soda Abyss;A vivid, chaotic underworld bursts from a fantastical can.
/SodaCan_386.png;Cosmic Doodle Deluge;A surreal explosion of vibrant alien graffiti.
/SodaCan_387.png;Abyssal Brew Fest;A psychedelic plunge into oceanic oddities.
/SodaCan_388.png;Soda Monster Mayhem;A vibrant can unleashing a pandemonium of whimsical creatures.
/SodaCan_389.png;Chaos Quencher Essence;A psychedelic fusion of thirsty pandemonium - uncannily vibrant!
/SodaCan_390.png;Mystical Creature Carnival;Whimsical beasts in vibrant revelry.
/SodaCan_391.png;Cosmic Brew Abyss;Surreal creatures swarm a cosmic can.
/SodaCan_392.png;Cosmic Can Conundrum;An otherworldly brew - chaos and colors encapsulated!
/SodaCan_393.png;Psychedelic CanVerse;An NFT odyssey of vibrant, surreal creatures.
/SodaCan_394.png;Psychedelic Ocean Frenzy;Surrealist sea of vibrant fantasy.
/SodaCan_395.png;Chromatic Predator Fizz;A vibrant, monstrous thirst-quencher.
/SodaCan_396.png;Monstrous Thirst Quencher 2;Surreal beverage can unleashes vibrant beastly appetite.
/SodaCan_397.png;Jurassic Quench Predator;Ferocious thirst, ancient roar!
/SodaCan_398.png;Ferocious Thirst Quencher 7;Unleash the beast within, one sip at a time.
/SodaCan_399.png;Jurassic Gulp Genesis;Prehistoric thirst unleashed!
/SodaCan_400.png;Jurassic Thirst Quencher 2;Ferocious sip of prehistory.
/SodaCan_401.png;Voracious Can Monster;Thirsty? Encounter a vivid beast of flavor!
/SodaCan_402.png;Jurassic Brew Fury;Fierce sips await!
/SodaCan_403.png;Mythic Can Serpent;Ferocious guardian unleashed from a mystical beverage.
/SodaCan_404.png;Mythic Canine Elixir;A ferocious, mystic brew—uncap the beast within.
/SodaCan_405.png;Mythic Can Dragon;Mystical brew guardian.
/SodaCan_406.png;Mythic Draconic Brew;Ferocious dragon-guarded elixir.
/SodaCan_407.png;Thirsty Myths Unleashed;Fantasy unleashed in effervescent artistry.
/SodaCan_408.png;Ferocious Thirst Quencher 8;Unleash the beastly flavor!
/SodaCan_409.png;Primal Sip Fury;Quenching Jurassic thirst.
/SodaCan_410.png;Mythical Thirst Quencher;Unleash legendary sips.
/SodaCan_411.png;Psychedelic Monster Brew;A vibrant concoction of wild, monstrous imagination.
/SodaCan_412.png;Chromatic Tentacle Brew;Vivid surrealism in a can.
/SodaCan_413.png;Spectral Soda Seas;Dive into a carbonated ocean of whimsical nightmares, fizzing with vibrant mayhem.
/SodaCan_414.png;Mythic Monster Mash;A jar teeming with vibrant, chaotic creatures.
/SodaCan_415.png;Psychedelic Monster Brew;Vibrant creatures trapped in a can.
/SodaCan_416.png;Chaos Concoction Canister;A vibrant abyss of untamed creatures.
/SodaCan_417.png;Cosmic Brew Odyssey;A fantastical voyage bottled in vibrant imagination.
/SodaCan_418.png;Psychedelic Canis Vortex;A vibrant vortex swirls within a mythic wolf's gaze.
/SodaCan_419.png;Chromatic Howl Brew;A vibrant, mystical wolf spirit captured in liquid art form.
/SodaCan_420.png;Cosmic Canine Canvas 5;Vibrant wolf spirit encapsulated in psychedelic artistry.
/SodaCan_421.png;Ferocious Flame Feline;A vivid, fiery roar encased.
/SodaCan_422.png;Chromatic Beast Brew;Vivid fury in a can—unleash the colors.
/SodaCan_423.png;Vibrant Howl Spectrum;A can emblazoned with a brilliantly colored, ferocious wolf spirit.
/SodaCan_424.png;Mystic Feral Brew 3;Enigmatic elixir guarded by a vibrant, wild spirit.
/SodaCan_425.png;Cosmic Canine Convergence;Vibrant astral wolf unleashed.
/SodaCan_426.png;Mythic Beast Brew;Fiery spirit captured in art.
/SodaCan_427.png;Ferocious Thirst Quencher 9;Sip the wild fury.
/SodaCan_428.png;Blossoming Serenity Dream;Ethereal beauty entwined in vibrant flora.
/SodaCan_429.png;Eternal Blossom Dreams;A surreal fusion of beauty and flora, immortalized in art.
/SodaCan_430.png;Astral Blossom Elegance;Enigmatic beauty blooms amidst cosmic serenity.
/SodaCan_431.png;Aquaflora Siren Can;Enchanting aquatic beauty blooms.
/SodaCan_432.png;AquaVivid Dreamer;Whimsical mermaid graces a mystic can.
/SodaCan_433.png;Feral Fizz Fury 1;Untamed energy unleashed in artful aluminum.
/SodaCan_434.png;Chromatic Mystic Gaze;Enchanting can artistry.
/SodaCan_435.png;Chromatic Chameleon Can 3;Vivid hues cloak this enigmatic, pop-art gecko.
/SodaCan_436.png;Psychedelic Chameleon Can;Vibrant fusion of art and illusion.
/SodaCan_437.png;Ferocious Fizz Fury 5;Can of cosmic rage.
/SodaCan_438.png;Psychedelic Soda Serpent;Vibrant fusion of myth and modernity.
/SodaCan_439.png;Ethereal Bloom Smile;Evoke the mystique of a joyful spirit adorned with floral grace.
/SodaCan_440.png;Chromatic Serpent Sip 1;A mythical, vibrant dragon encases this mystical beverage.
/SodaCan_441.png;Chameleon Canvass Can;A vibrant, psychedelic chameleon cloaked in artistry.
/SodaCan_442.png;Feral Fizz Fury 2;Unleashed energy in a can.
/SodaCan_443.png;Chromatic Chameleon Can 4;Vividly-hued, mystical creature adorning a can.
/SodaCan_444.png;Gecko Garden Brew;Mystical gecko guards secret nectar.
/SodaCan_445.png;Mystic Totem Quencher;Enchanted vessel, storytelling in hues.
/SodaCan_446.png;Mystical Visionary Totem;A vibrant totem of wisdom.
/SodaCan_447.png;Arboreal Alchemy Ale;Enigmatic brew of nature's intricate enchantment.
/SodaCan_448.png;Ethereal Arbor Abbey;Mystical sanctuary entwined in timeless, fiery groves.
/SodaCan_449.png;Arboreal Sanctuary Can;Ethereal forest engulfs mystical urban oasis.
/SodaCan_450.png;Mystic Arbor Canister;Intricate arboreal etchings encase mystical liquid lore.
/SodaCan_451.png;Mountain Stream Serenity;Unwind in illustrated tranquility.
/SodaCan_452.png;Midnight Arbor Essence;Enigmatic twilight, encapsulated.
/SodaCan_453.png;Eerie Brew Canister;Hauntingly carved, endless night.
/SodaCan_454.png;Aquafloral Elegance Canister;Mesmerizing koi dance among blooming aquatics.
/SodaCan_455.png;Tropical CanScape;Lush paradise in aluminum.
/SodaCan_456.png;Vivid Oni Vessel;An electrifying fusion of folklore and pop art.
/SodaCan_457.png;Sundown Sailing Serenity;Tranquil sails at sunset, embodying peace.
/SodaCan_458.png;Sundown Sail Can;A serene sailboat journey captured on a can, basking in twilight's glow.
/SodaCan_459.png;Sailor's Sunset Brew;Crisp sailboat against an amber sundown – a voyage in a can.
/SodaCan_460.png;Feral Fizz Fiend 2;Unleash the beast within the can!
/SodaCan_461.png;Ferocious Fizz Fury 6;Unleashed soda monster.
/SodaCan_462.png;MechSaur Dynamo;Cyber-dinosaur unleashed.
/SodaCan_463.png;Eternal Midnight Brew;Gothic allure encapsulated.
/SodaCan_464.png;Ghastly Gulp Gargoyle;A monstrous can unleased.
/SodaCan_465.png;Graffiti Gobble Can;Urban art comes alive, hungry for chaos.
/SodaCan_466.png;Crimson Necropolis Brew;A macabre dance of death and decay, hauntingly encapsulated under a blood moon.
/SodaCan_467.png;Gargantuan Gulp Ghoul;A monstrous thirst-quencher.
/SodaCan_468.png;Crimson Eclipse Mausoleum;A haunting twilight over an eerie, skull-littered gothic realm.
/SodaCan_469.png;Crimson Ecliptic Requiem;Eternal love amidst gothic twilight.
/SodaCan_470.png;Crimson Twilight Requiem;Eternal rest under a haunted moon.
/SodaCan_471.png;Crimson Moonlit Requiem;A haunting castle under a blood-red moon.
/SodaCan_472.png;Crimson Phantom Brew;Elixir of eternal night, housed in gothic artistry.
/SodaCan_473.png;Crimson Macabre Brew;Haunting fusion of gothic allure and spectral whispers in a can.
/SodaCan_474.png;Gremlin Soda Surprise;Thirst-quenching terror pop!
/SodaCan_475.png;Crimson Nocturne Can;Haunted castle encapsulated in a chilling, moonlit brew.
/SodaCan_476.png;Jungle Majesty Canister;Fierce elegance captured in artful fauna.
/SodaCan_477.png;Jungle Essence Canister 1;Majestic tiger spirit, captured in vibrant jungle flora.
/SodaCan_478.png;Jungle Can Majesty 1;Fierce gaze embossed, nature's king canned.
/SodaCan_479.png;Jungle Can Majesty 2;Feline prowess encased in art.
/SodaCan_480.png;TigerSoda Roar;Unleash the beast within - a ferocious blend of art and energy.
/SodaCan_481.png;Cosmic Tiger Brew;Enigmatic tiger adorning the stars.
/SodaCan_482.png;Stargazer Sovereign Brew;Mystical tiger adorns cosmic elixir.
/SodaCan_483.png;Tiger Swirl Essence 1;Fierce elegance captured in artful swirls.
/SodaCan_484.png;Tiger Essence Vessel;Ferocious grace in artful aluminum.
/SodaCan_485.png;Tiger Fizz Roar;Vibrant jungle energy captured in an effervescent can.
/SodaCan_486.png;Tiger Swirl Canister 1;Majestic tiger entwined with vibrant, flowing artistry.
/SodaCan_487.png;Ferocious Can Roar;Unleash the wild within.
/SodaCan_488.png;Ferocity Fizz Roar;A can emblazoned with primal power.
/SodaCan_489.png;Feral Brew Roar;Unleashed tiger spirit, captured in an iron vessel.
/SodaCan_490.png;Tiger's Roaring Elixir;Ferocious thirst-quencher unleashed.
/SodaCan_491.png;Feral Brew Rage;Untamed spirit encased, roar in every sip.
/SodaCan_492.png;Feral Fizz Roar;Unleashed energy in a can.
/SodaCan_493.png;Ferocity Unleashed Can;Primal roar encased - collectible vigor.
/SodaCan_494.png;Tiger Swirl Essence 2;Stylized tiger adorns a vibrant, mystical can.
/SodaCan_495.png;AquaTiger Essence;Ferocity canned in waves.
/SodaCan_496.png;Cosmic Tiger Essence;Vibrant fusion of wild spirit and cosmic swirls.
/SodaCan_497.png;Cosmic Tigress Graffiti;Vibrant jungle spirit encapsulated in cosmic swirls.
/SodaCan_498.png;Feral Fluidity Can;Majestic tiger merges with liquid artistry.
/SodaCan_499.png;Tiger Swirl Canister 2;A vivid tiger emerges from abstract swirls, encapsulating wild elegance.
/SodaCan_500.png;Ferocity Fizz Can;Unleash the roar within.
/SodaCan_501.png;Jungle Sovereign Sip;Fierce elegance encapsulated.
/SodaCan_502.png;Jungle Essence Canister 2;Fierce gaze captured in artful stillness.
/SodaCan_503.png;Jungle Essence Canister 3;Feral gaze encased.
/SodaCan_504.png;Jungle Majesty Can;A vibrant can cloaked in the fierce gaze of the wild tiger.
/SodaCan_505.png;Astral Tiger Surge;Ethereal feline spirit captured in cosmic swirls.
/SodaCan_506.png;Jungle Essence Vessel;Fierce elegance captured in can.
/SodaCan_507.png;Urban Oasis Brew 1;A vibrant, illustrated can captures the spirit of city life entwined with nature.
/SodaCan_508.png;Urban Flora Flight;Ethereal koi soars over a bloom-engulfed cityscape.
/SodaCan_509.png;Urban Oasis Can 1;Fizzy dreams amidst concrete blooms.
/SodaCan_510.png;Urban Koi Haven;A vivid koi swims through a stylized cityscape, where concrete meets nature.
/SodaCan_511.png;Tropical Serenity Can 1;Sunset-hued can encapsulating a tranquil paradise.
/SodaCan_512.png;Tropical Can Serenity 1;Sunset bliss in a metallic canvas—art and nature's fusion.
/SodaCan_513.png;Mariner's Mythos Can;Oceanic lore encapsulated in aluminum, a siren's call in art form.
/SodaCan_514.png;Oceanic Starfall Brew;An aquatic ballet wrapped in a can, where stars dive and waves dance.
/SodaCan_515.png;Tropical Canvased Waves;Island spirit captured on a can: a sip of oceanic adventure.
/SodaCan_516.png;Tropical Canopy Dreams;Evoke the tropics with lush botanicals on a sleek canister.
/SodaCan_517.png;Tropical Sundown Brew;A vibrant can blending ocean vibes with sunset serenity.
/SodaCan_518.png;Aquaflora Serenity Can;An exquisite goldfish swims among tranquil floral waters.
/SodaCan_519.png;Crimson Koi Waves;Elegant aquatic dance immortalized on aluminum canvas.
/SodaCan_520.png;Aquaflora Koi Harmony 1;Elegance encased: a serene, aquatic dance.
/SodaCan_521.png;Aquatic Elegance Essence;Ornate koi graces oceanic flora.
/SodaCan_522.png;Aquaflora Koi Fantasy;Vivid koi swims amidst blossoming flora on a magical can.
/SodaCan_523.png;Aquaflora Koi Harmony 2;Ethereal koi swims among blossoms, encapsulating serenity.
/SodaCan_524.png;Aquaflora Elegance;Ethereal koi swims through blooming aquatic fantasy.
/SodaCan_525.png;Aurora Carp Can;Vibrant koi swims in a floral sea, captured in a can.
/SodaCan_526.png;Aquatic Blossom Vessel;Elegant koi swims amidst floral serenity.
/SodaCan_527.png;Aquaflora Serenity Swim;Vibrant koi bathes in floral elegance.
/SodaCan_528.png;Aquatic Can Artistry;Vivid koi fish dance on a surreal aquatic can canvas.
/SodaCan_529.png;Aurora Koi Blossom;Ethereal aquatic artistry, serenely encapsulated.
/SodaCan_530.png;Cartographic Quencher Odyssey 1;Thirst for exploration? Sip the journey!
/SodaCan_531.png;Urban Thirst Quencher;A beverage container cloaked in the intricate urban tapestry.
/SodaCan_532.png;Cartographic Quencher 1;Sip the city's essence.
/SodaCan_533.png;Cartographic Quench 1;Antique maps wrap thirst, blending history with modern sips.
/SodaCan_534.png;Cartographic Quencher 2;A journey in a sip.
/SodaCan_535.png;Cartographic Quencher 3;A beverage mapping journeys.
/SodaCan_536.png;Cartographic Thirst Quencher;Sip the cityscape: a beverage can mapped with urban intrigue.
/SodaCan_537.png;Cartographic Quench 1;Sip the city's essence.
/SodaCan_538.png;Cartographic Quencher 4;Thirst for exploration.
/SodaCan_539.png;Cartographic Quencher Odyssey 2;A can emblazoned with journeys past—sip the essence of exploration.
/SodaCan_540.png;Cartographic Quencher 5;Thirst for adventure? Sip the world!
/SodaCan_541.png;Urban Circuitry Quencher;Thirst for exploration captured in aluminum.
/SodaCan_542.png;CartographiCan Voyage;Explore liquid highways in a can.
/SodaCan_543.png;Tropical Canopy Cascade;A can's journey through paradise.
/SodaCan_544.png;Tropical Serenity Can 2;An effervescent fusion of flora and sea, capturing nature's tranquility.
/SodaCan_545.png;Tropical Sunset Serenade;Capturing twilight's dance amid floral waves.
/SodaCan_546.png;Sundowner Serenity Sip;Tropical oasis on a can: a sunset drink of dreams.
/SodaCan_547.png;Tropical Serenity Can 3;Harmony in a can: a lush, vibrant escape.
/SodaCan_548.png;Aquaflora Serenade;A fusion of ocean waves and blossoming flowers, encapsulating nature's harmony.
/SodaCan_549.png;Sunset Siren's Can;Oceanic artistry adorning a sun-kissed sea.
/SodaCan_550.png;Tropical Can Serenity 2;An artful blend of sea, flora, and serenity in a can.
/SodaCan_551.png;Tropical Canopy Harmony;A vivid tapestry of nature's symphony, captured on a serene, exotic canvas.
/SodaCan_552.png;Tropical Can Artistry;An oasis dreamscape wrapped around a can, fusing nature's palette with exotic serenity.
/SodaCan_553.png;Tropical CanScape;Sunset hues in a can.
/SodaCan_554.png;Tropical Serenity Brew;Sip the essence of a tranquil paradise.
/SodaCan_555.png;Urban Oasis Can 2;Cityscape meets nature on vibrant canvas.
/SodaCan_556.png;Crimson Cityscape Elixir;Urban dreams swirl in a can.
/SodaCan_557.png;Urban Koi Dreams 1;Vibrant dreamscape of a koi fish merging with the city's heartbeat.
/SodaCan_557.png;Urban Koi Dreams 2;Surreal cityscape meets vibrant aquatic life in a can.
/SodaCan_558.png;Urban Sunset Sip;Twilight harmony in a can.
/SodaCan_559.png;Urban Oasis Dreams;Metropolis merges with nature, encapsulated in a can.
/SodaCan_560.png;Urban Sip Serenity;A tranquil cityscape enveloped in a can.
/SodaCan_561.png;Urban Oasis Brew 2;Cityscape in a can.
/SodaCan_562.png;Urban Oasis Brew 3;A serene cityscape captured on a crafty can.
/SodaCan_563.png;Urban Oasis Can 3;A beverage can depicting a vibrant cityscape with a splash of nature's escape.
/SodaCan_564.png;Tentacle Canoodle Can;Vibrant abyss of swirling tentacles.
/SodaCan_565.png;Tentacle Swirl Can;A vibrant abyss in a can.
/SodaCan_566.png;Psychedelic Liquid Container;A vibrant, surreal can alive with mesmerizing patterns.
/SodaCan_567.png;Abyssal Soda Menace;An enigmatic can unleashes a psychedelic cephalopod fantasy.
/SodaCan_568.png;Cyclopean Soda Monster;Vibrant tentacle chaos engulfs a can.
/SodaCan_569.png;PsychedeLique Tentacool;Intricate tentacles wrap a mystical can.
/SodaCan_570.png;Psychedelic Vision Can;A surreal, eye-popping vessel.
/SodaCan_571.png;Visionary Vortex Can;A mesmerizing swirl of art, awakening imagination with each gaze.
/SodaCan_572.png;Psychedelic Vision Canister;A mesmerizing kaleidoscope of colors emblazons this captivating piece.
/SodaCan_573.png;Psychedelic Sip Specter;Eerie elixir, vibrant haunts.
/SodaCan_574.png;Psychedelic Sip Serenade;A vivid dance of mythical flavors.
/SodaCan_575.png;Spectral Sip Serpent;An ornate can springs to life with vibrant, monstrous elegance.
/SodaCan_576.png;Psychedelic Gaze Can;Vibrant abyss in aluminum.
/SodaCan_577.png;Psychedelic Vision Elixir;Eerie canister adorned with hypnotic, otherworldly gazes.
/SodaCan_578.png;Tentacled Canister Delirium;Inky dread grins from a psychedelic abyss.
/SodaCan_579.png;Psychedelic Oceanic Gaze;An enthralling voyage through mystical marine madness.
/SodaCan_580.png;Arboreal Elixir Can;Eternal grove encapsulated in golden serenity.
/SodaCan_581.png;Verdant Canopy Vessel;An eternal tree thrives, encased in golden artistry.
/SodaCan_582.png;Arboreal Harmony Can;Mystical fusion of nature and artifact.
/SodaCan_583.png;Arboreal Elixir Essence;A beverage can transformed into a lush, living forest tableau.
/SodaCan_584.png;Arboreal Brew Essence;An enchanting fusion of nature and craftsmanship.
/SodaCan_585.png;Arboreal Elixir Vessel;A mystical tree-infused potion jar, symbolizing nature's enchanting essence.
/SodaCan_586.png;Arboreal Essence Vessel;Can embracing ancient trees, a living vessel of time.
/SodaCan_587.png;Gilded Arboreal Relic;A majestic tree encapsulates nature's timeless beauty.
/SodaCan_588.png;Tentacle Tangle Flask;Oceanic enigma encased.
