File Path;Name;Description
/SodaCan_1.png;Blossoming Aqua Surge;Eternal waves bloom with timeless beauty.
/SodaCan_2.png;Aqua Vortex Can;Elegantly cloaked brew, a tidal art embrace.
/SodaCan_3.png;Cerulean Tsunami Vessel;A wave-adorned can, encapsulating the fury and grace of the sea.
/SodaCan_4.png;Aqua Elegance Swirl;Ornate waves adorn this mystic vessel.
/SodaCan_5.png;Surging Crest Canister;Fluid artistry enfolds a vessel, encapsulating the ocean's raw power.
/SodaCan_6.png;Oceanic Essence Can;Swirling waves captured on aluminum, a dance of sea's spirit.
/SodaCan_7.png;Aqua Swirl Elixir;Intricate waves enwrap a mysterious vintage brew.
/SodaCan_8.png;Aegean Wave Vessel;Mystic sea waves swirl on a timeless vessel.
/SodaCan_9.png;Aquafloral Tsunami Can;Swell of botanical elegance.
/SodaCan_10.png;Aquafloral Vortex Can;Serene waves embrace vivid florals, encapsulating nature's dance.
/SodaCan_11.png;Blossom Tsunami Dreams;A floral fantasy amidst a cresting azure wave.
/SodaCan_12.png;Oceanic Brew Vortex;Surreal sea waves encapsulate an enigmatic beverage can.
/SodaCan_13.png;Oceanic Canvass Swell;Serene waves immortalized on aluminum.
/SodaCan_14.png;Tsunami Art Can;Sweeping waves adorn this collectible can, merging art with utility.
/SodaCan_15.png;Floral Bison Brew;Enigmatic bison adorned in vibrant flora.
/SodaCan_16.png;Floral Bison Grace;A bison's serene gaze amidst vibrant blooms.
/SodaCan_17.png;Floral Bovine Harmony;Mystical bovine adorned with vibrant blooms.
/SodaCan_18.png;Floral Bison Spirit;Mystic bison adorned with autumn blooms.
/SodaCan_19.png;Cosmic Taurine Canister;Space-infused bovine majesty.
/SodaCan_20.png;Mystical Bovine Brew;An enigmatic ox adorns this ornate vessel, hinting at mythical elixirs within.
/SodaCan_21.png;Bovine Brew Majesty;Mystical fusion of strength and spirit in a can.
/SodaCan_22.png;Mystic Bovine Brew;A fusion of fierce gaze and spirited artistry—the liquid talisman.
/SodaCan_23.png;Mystic Bull Brew 1;A vibrant fusion of tribal art and modern design, encapsulating strength and mystique.
/SodaCan_24.png;Mystic Taurine Elixir;Enigmatic fusion of totemic strength and psychedelic swirls.
/SodaCan_25.png;Mystic Bull Brew 2;Enigmatic elixir encased in art.
/SodaCan_26.png;Mystic Bison Brew;Enigmatic potion encased in a can, crowned by a mythic bison spirit.
/SodaCan_27.png;Mystic Bull Essence;Enigmatic can-bound bovine deity.
/SodaCan_28.png;Mystical Bison Brew;Enchanting elixir encased in mighty bison imagery.
/SodaCan_29.png;Majestic Bull Can;Ornate bovine power encased in mystique.
/SodaCan_30.png;Mythic Flame Bison;A majestic bison adorned with fiery artistry, encapsulating untamed spirit.
/SodaCan_31.png;Chromatic Bull Can;Vivid hues encapsulate bovine boldness.
/SodaCan_32.png;Spectrum Taurine Can;A vibrant bull encapsulated in liquid artistry.
/SodaCan_33.png;Bovine Spectrum Can;Vibrant highland cow emerges from a kaleidoscope can.
/SodaCan_34.png;Spectrum Steer Can;A vibrant bull, canned in colors.
/SodaCan_35.png;Mystic Can Guardian;Enigmatic protector emerges, embodying ancient can's spirit.
/SodaCan_36.png;Totem Energy Drink;A vibrantly monstrous thirst-quencher.
/SodaCan_37.png;Enchanted Emberling Totem;Mystical totem sprouting life and fire.
/SodaCan_38.png;Mystic Arbor Guardian;Enchanting forest sentinel.
/SodaCan_39.png;Cerebral Brew Monster;Enigmatic elixir guardian.
/SodaCan_40.png;Mystic Flame Keeper;Guardian of ancient infernal wisdom.
/SodaCan_41.png;Mystical Autumn Guardian;Enigmatic entity amidst fall foliage.
/SodaCan_42.png;Mystic Brew Guardian 1;Enchanted can's sentient gaze.
/SodaCan_43.png;Mythical Brew Guardian;Ethereal, vibrant guardian emerges, ensnaring imagination in aluminum.
/SodaCan_44.png;Mystic Fizz Guardian;Enchanted elixir's whimsical protector.
/SodaCan_45.png;Chromatic Creature Can;Vibrant monster-populated beverage container.
/SodaCan_46.png;Eldritch Canister Cryptid;Mystical creature captured in vibrant artistry.
/SodaCan_47.png;Enchanted Elixir Guardian;Mysterious protector of the mystical brew, awakened from the can's vibrant curse.
/SodaCan_48.png;Mystic Brew Guardian 2;Enigmatic sentinel of flavor.
/SodaCan_49.png;Cryptic Can Critter;Enigmatic beverage guardian.
/SodaCan_50.png;Mystic Gaze Canister 3;Enchanted vessel with a whimsical charm.
/SodaCan_51.png;Mystic Brew Guardian 3;Enchanted elixir's fierce protector.
/SodaCan_52.png;Bubbly Scales Sparkle;Quirky fizz-guardian of joy!
/SodaCan_53.png;Aqua Fang Brew;Quenching monstrous thirsts.
/SodaCan_54.png;Mystic Brew Beast;A vibrant creature encapsulated in an arcane potion!
/SodaCan_55.png;Ferocious Fizz Fiend 5;Monstrous soda can erupts with wild, untamed flavor!
/SodaCan_56.png;Mystic Soda Guardian;Enchanted can protecting mystical realms.
/SodaCan_57.png;Tiki Can Terror;An animated can personifies primal fear.
/SodaCan_58.png;Totemic Thirst Sentinel;Ancient guardian unleashed, thirsting for souls.
/SodaCan_59.png;Azure Guardian Grin;Mystical totem creature with an enigmatic smile.
/SodaCan_60.png;Azurite Dragon Totem;Mystical guardian unleashed.
/SodaCan_61.png;Totemic Thirst Quencher;Ancient thirst, modern vessel.
/SodaCan_62.png;Aqua Totem Thirst;Mystic thirst-quenching relic.
/SodaCan_63.png;Tiki Giggle Goblet;Eccentric laughter incarnate.
/SodaCan_64.png;Chimeric Canister Chuckle;An enigmatic jar's laughter echoes, weaving mystic tales.
/SodaCan_65.png;Azure Mystic Grin;Enigmatic smile illuminates ancient secrets.
/SodaCan_66.png;Flamehorn Canister;Fiery-eyed bovine graces this can, merging wild spirit with urban chic.
/SodaCan_67.png;Mystic Flora Bison;An enchanting bovine amid autumn's whisper.
/SodaCan_68.png;Mythic Brew Bison;A mystical bison adorned with vibrant, swirling patterns—imbued with the spirit of ancient legends.
/SodaCan_69.png;Mystic Flame Bison;Ethereal beast captured in flames.
/SodaCan_70.png;Spectrum Bovine Brew;A fusion of vibrant hues and stoic bovine mystique, canned.
/SodaCan_71.png;Cosmic Owl Canister;Mystical vessel pulsing with stardust energy.
/SodaCan_72.png;Abyssal Canister Totem;Enigmatic totem art, encapsulated in a can.
/SodaCan_73.png;Ferocious Fizz Monster;Ancient thirst unleashed.
/SodaCan_74.png;Ferocious Fizz Guardian 2;A can with a monstrous spirit, guarding an effervescent secret.
/SodaCan_75.png;Ferocious Fizz Fiend 6;A vibrant, monster-wrapped can.
/SodaCan_76.png;Abyssal Beverage Behemoth;A vibrant, monstrous can with a threatening, yet whimsical, demeanor.
/SodaCan_77.png;Feral Fizz Monster;An untamed refreshment beast unleashed.
/SodaCan_78.png;Enchanted Frost Spirit;A whimsical being celebrates amidst a vibrant wintery dreamscape.
/SodaCan_79.png;Cosmic Joy Emissary;A mystical being radiates happiness across vibrant, otherworldly vistas.
/SodaCan_80.png;Cosmic Soda Sprite 2;A whimsical creature nestled in an effervescent universe-in-a-can.
/SodaCan_81.png;Cosmic Sprout Canopy;A whimsical entity basks in a vibrant, cosmic garden.
/SodaCan_82.png;Celestial Dreamer's Brew;A whimsical entity toasts the cosmos from an enchanted can.
/SodaCan_83.png;Citrus Monster Brew;Fierce flavor unleashed!
/SodaCan_84.png;Ferocious Fizz Guard;Thirst-quenching defender arises from the carbonated depths.
/SodaCan_85.png;Mystic Feathered Brew;Enigmatic owl can adorned in vibrant plumage art.
/SodaCan_86.png;Cansaurus Vibrant Roar;Vibrant beast unleashed from a can.
/SodaCan_87.png;Cosmic Soda Sentinel;A quirky guardian in an effervescent cosmos.
/SodaCan_88.png;Frosty Can Fable;A whimsical soda creature captivating frosty friends.
/SodaCan_89.png;SodaPeak Gleefulness;A can's mountainous grin.
/SodaCan_90.png;Cosmic Smiles Can;An otherworldly beverage can, brimming with joyous cosmic vistas.
/SodaCan_91.png;Celestial Sprout Harmony;Mystic creatures bask in stellar serenity.
/SodaCan_92.png;Cosmic Kinship Canister;Alien family amidst celestial swirls.
/SodaCan_93.png;Cosmic Kindred Spirits;Intergalactic family amidst cosmic waves, a glimpse into alien unity.
/SodaCan_94.png;Galactic Dreamscape Ale;A cosmic brew, swirling with stardust and whimsy.
/SodaCan_95.png;Mirthful Nature's Can;Vivid, whimsical flora dance under a moonlit sky.
/SodaCan_96.png;Cosmic Canopy Cascade;Surreal worlds unfurl in vibrant liquid dreams.
/SodaCan_97.png;Cosmic Sodapop Visions;A mystical journey in a can, where galaxies meet soda fizz.
/SodaCan_98.png;Fizzy Monster Mirth;A jolly can-creature frolics in a wintery sprite night.
/SodaCan_99.png;Monster Soda Surprise 2;An animated soda can unveiling a playful creature within a mystical landscape.
/SodaCan_100.png;Soda Monster Mirth;Quirky creature's canned joy!
/SodaCan_101.png;Gulp Monster Can;Thirst-quenching terror unleashed.
/SodaCan_102.png;Cosmic Soda Peaks;Fizzing with cosmic chill.
/SodaCan_103.png;Fizzy Peak Elixir;Enchanted soda can beneath a starlit sky.
/SodaCan_104.png;Mountain Murmur Mirth;A whimsical can encapsulating laughter and landscape.
/SodaCan_105.png;Mirthful Monster Mash;A playful clash of vibrant, quirky characters in a can!
/SodaCan_106.png;Monster Soda Surprise 1;Quirky can creature bubbling with fun!
/SodaCan_107.png;Thirsty Monster Fizz;Quenching monstrous thirsts!
/SodaCan_108.png;Aqua Monster Brew;Sip into the abyss.
/SodaCan_109.png;Fizzing Monster Brew;An eccentric can creature oozing with lively personality!
/SodaCan_110.png;Aqua Serenade Canister;Enchanted marine life dances under a moonlit symphony.
/SodaCan_111.png;Cosmic Soda Nebula;A vibrant can where cosmic waves and a cheerful star converge.
/SodaCan_112.png;Enchanted Cosmic Bloom;A vibrant can art, where cosmic whimsy meets flora.
/SodaCan_113.png;Cosmic Sodapop Dreams;Whimsical beverage can teeming with vibrant, dreamlike fantasy.
/SodaCan_114.png;Monstrous Mirth Can;Vibrant canister harboring a jovial beast within.
/SodaCan_115.png;Cosmic Soda Sprite 1;An interstellar soda-can entity frolics amidst snowy peaks.
/SodaCan_116.png;Arctic Essence Canister 1;Majestic polar sentinel, forever encased.
/SodaCan_117.png;Arctic Sentinel Brew 1;A polar guardian’s icy gaze, encapsulated in frosted metal.
/SodaCan_118.png;Arctic Sentinel Can 1;Majestic polar bear guardian, encapsulated in icy serenity.
/SodaCan_119.png;Chilled Arctic Sentinel;An imposing polar bear stands guard within a frosty canister.
/SodaCan_120.png;Arctic Majesty Canister;Frozen wilderness encapsulated.
/SodaCan_121.png;Arctic Essence Captured 1;A polar bear's spirit, forever encased in a frosted vessel.
/SodaCan_122.png;Frosted Polar Essence;A polar bear's mystical emergence from a frosted can, illuminating winter's magic.
/SodaCan_123.png;Arctic Essence Brew;A polar bear immortalized in a can, symbolizing nature's frozen purity.
/SodaCan_124.png;Arctic Essence Can 1;Polar bear's wintry spirit captured in frosted aluminum.
/SodaCan_125.png;Arctic Sovereign Can;Majestic polar bear towering over its frosty realm.
/SodaCan_126.png;Arctic Sovereign Sentinel 1;A majestic polar bear guards its icy realm.
/SodaCan_127.png;Arctic Sentinel Brew 2;Majestic polar guardian graces this frosty brew can.
/SodaCan_128.png;Arctic Sentinel Majesty;Majestic guardian of icy realms.
/SodaCan_129.png;Frost Sovereign Sentinel;Majestic bear guards icy realm.
/SodaCan_130.png;Arctic Sentinel Can 2;Majestic polar bear guards frosty wilderness.
/SodaCan_131.png;Arctic Sovereign Sentinel 2;Majestic bear guards frosty realm.
/SodaCan_132.png;Arctic Sovereign Sentinel 3;Majestic guardian of frost realms.
/SodaCan_133.png;Arctic Essence Can 2;A cub preserved in icy serenity.
/SodaCan_134.png;Arctic Can Cub;Chill in wilderness.
/SodaCan_135.png;Arctic Essence Can 3;Polar cub in a can, symbolizing frozen innocence.
/SodaCan_136.png;Arctic Essence Canister 2;Preserved polar innocence.
/SodaCan_137.png;Mystic Jungle King;Vibrant lion's spirit captured in psychedelic colors.
/SodaCan_138.png;Primal Gaze Thirst;A stoic simian's visage, encapsulated in vibrant pop art, thirsting for attention.
/SodaCan_139.png;Primal Sip Sovereign;A can cloaked in primal power, eyes ablaze with silent tales.
/SodaCan_140.png;Chromatic Canine Gaze;A vibrant, soulful stare captured amidst psychedelic swirls.
/SodaCan_141.png;Mystic Feline Aura;An enchanting, vividly colored lion's essence captured on a can.
/SodaCan_142.png;Psychedelic Primal Gaze;Mystic beast in vibrant trance.
/SodaCan_143.png;Mystic Primate Elixir 1;A vibrant symphony in a can.
/SodaCan_144.png;Mystic Spectrum Simian;Vibrant tribal mandrill, encased in artistry.
/SodaCan_145.png;Vivid Primate Elixir;A psychedelic simian vision in a can.
/SodaCan_146.png;Mystic Primate Elixir 2;Enigmatic, vibrant simian spirit captured in artful serenity.
/SodaCan_147.png;Mystic Feline Brew;Enchanting psychedelic lion can.
/SodaCan_148.png;Mystic Primal Gaze;Vibrant tribal wisdom captured in a mesmerizing artwork.
/SodaCan_149.png;Mystical Mandrill Mosaic;Vibrant soul in aluminum.
/SodaCan_150.png;Mystic Feral Brew 1;A vibrant, mystical beast invites intrigue in a liquid canvas.
/SodaCan_151.png;Mystic Primal Sip;A vibrantly psychedelic simian adorns this can, offering a taste of wild imagination.
/SodaCan_152.png;Mythical Spectrum Simian;A vibrant mandrill mystique.
/SodaCan_153.png;Mystic Lion Brew;Vibrant fusion of artistry and spirit on a can.
/SodaCan_154.png;Mystic Mandala Mane;Enigmatic lion graced with kaleidoscopic tribal artistry.
/SodaCan_155.png;Chromatic Primate Mystique;Vividly-hued simian gazes, encapsulating wild artistry.
/SodaCan_156.png;Flame-Maned Monarch;Vibrant lion king captured in a can.
/SodaCan_157.png;Floral Lion Essence;Vivid hues capture a lion's spirit amidst autumn's bloom.
/SodaCan_158.png;Prismatic Apex Can;Vibrant beast in repose, encased in aluminum.
/SodaCan_159.png;Chromatic Primal Essence;A psychedelic journey into the soul of nature's untamed spirit.
/SodaCan_160.png;Mystic Feral Brew 2;Enigmatic eyes guard the elixir within.
/SodaCan_161.png;Mystic Primal Brew;An ancient beast's gaze, mystically captured on a vibrant vessel.
/SodaCan_162.png;Mystic Mane Majesty;Vibrant lion spirit encased in artistry.
/SodaCan_163.png;Prismatic Ape Majesty;A vibrant, tribal visage—Mystique in every hue.
/SodaCan_164.png;Mystic Lion Brew;An ethereal lion, adorning vibrant wisdom, guarding the sacred elixir.
/SodaCan_165.png;Mystic Mandala Monkey;Color-drenched simian royalty: an NFT steeped in mystique.
/SodaCan_166.png;Patriotic Primate Pride;A can emblazoned with a solemn gorilla amid stars and stripes.
/SodaCan_167.png;Patriotic Primate Brew 1;Intrepid gaze captured in aluminum: freedom sips inspiration.
/SodaCan_168.png;Patriotic Primate Power 1;A striking fusion of raw strength and national spirit, encapsulated.
/SodaCan_169.png;Primate Patriot Pop;A solemn simian emblazoned with vibrant valor.
/SodaCan_170.png;Patriotic Primal Gaze 1;An intense fusion of wild spirit and bold symbolism.
/SodaCan_171.png;Primal Artistry Brew;Vibrant primal gaze encapsulated in a psychedelic liquid canvas.
/SodaCan_172.png;Patriotic Primate Ponder;Mystique in a can, where untold stories of simian sovereignty unfold.
/SodaCan_173.png;Patriotic Primate Can 1;Primal gaze wrapped in stars and stripes.
/SodaCan_174.png;Primal Gaze Canister 1;Enigmatic ape eyes enthrall, encased in vibrant artistry.
/SodaCan_175.png;Patriotic Primate Power 2;An iconic blend of Americana and animal majesty.
/SodaCan_176.png;Patriotic Primate Pint;Cosmic gorilla enshrined in star-spangled serenity.
/SodaCan_177.png;Patriotic Primate Brew 2;A stoic gorilla adorned in stars and stripes, encapsulating a wild spirit.
/SodaCan_178.png;Patriotic Primate Can 2;A stoic simian symbolizing strength and spirit.
/SodaCan_179.png;Patriotic Primate Can 3;A stirring fusion of wildlife and national pride emblazoned on aluminum.
/SodaCan_180.png;Patriotic Primate Portent;A stoic simian symbolizes untold tales of valor and enigma.
/SodaCan_181.png;Primal Gaze Elixir;Intense, mystic primate adorns a vibrant vessel.
/SodaCan_182.png;Patriotic Primate Prowess;A gaze of freedom: untamed spirit encased.
/SodaCan_183.png;Primal Gaze Canister 2;Intense simian eyes, canned wildness.
/SodaCan_184.png;Primal Sip Visionary;A brooding ape adorns this can, embodying wild wisdom and untamed spirit.
/SodaCan_185.png;Patriotic Primal Gaze 2;Mystical ape's stare captivates from a star-spangled canvas.
/SodaCan_186.png;Primal Gaze Soda;A fusion of wild instinct and pop culture.
/SodaCan_187.png;Primal Gaze Energy;A stoic simian's visage, melding wild instinct with urban flair.
/SodaCan_188.png;Primal Soda Spirit;Enigmatic simian gaze, canned.
/SodaCan_189.png;Primal Star Vessel;Cosmic energy trapped in primal gaze.
/SodaCan_190.png;Cosmic Primate Elixir;Intergalactic ape brew, star-infused vitality.
/SodaCan_191.png;Psychedelic Canine Quench;Vibrant fusion of art and loyalty in a can.
/SodaCan_192.png;Spectral Canine Canvas;A vibrant, pop-art pooch adorns this collectible can.
/SodaCan_193.png;Cosmic Canine Brew;Vibrant hues capture a starry-eyed pup's cosmic journey.
/SodaCan_194.png;Mystic Canine Canvas 1;An enigmatic fusion of tribal art and canine spirit, captured in aluminum.
/SodaCan_195.png;Cosmic Canine Canvas 1;A vibrant pug encapsulated in cosmic artistry.
/SodaCan_196.png;Vibrant Canine Elixir;Whimsical hues enliven a dog's gaze, captured in a can.
/SodaCan_197.png;Mystical Canine Canvas;Enigmatic pup adorned in tribal art, encapsulating ancestral spirits.
/SodaCan_198.png;Cosmic Canine Concoction;Vibrant pup's psychedelic swirls entice.
/SodaCan_199.png;Kaleidoscope Canine Cool;Vivid pop-art pooch on a can.
/SodaCan_200.png;Vibrant Canine Canvas;A pop-art pup in a kaleidoscope of colors, expressing the fusion of art and the digital age.
/SodaCan_201.png;Psychedelic Pup Can;Vibrant dog unleashed in colors.
/SodaCan_202.png;Spectrum Sentinel Canine;Vibrant guardian in a can.
/SodaCan_203.png;Canine Spectrum Vision;Vivid hues paint a dog's dream.
/SodaCan_204.png;Cosmic Canine Quench 1;Interstellar thirst meets vibrant guardian.
/SodaCan_205.png;Psychedelic Canine Spirit;Vibrant mandala-infused guardian.
/SodaCan_206.png;Kaleidoscope Canine Quencher;Vibrant thirst for playfulness.
/SodaCan_207.png;Chromatic Canine Quench;Vibrant thirst for artistry.
/SodaCan_208.png;Tribe Canine Canvas;Vibrant dog-inspired art-can, fusing tradition with modernity.
/SodaCan_209.png;Psychedelic Pup Can;Vibrant canine artistry in aluminum.
/SodaCan_210.png;Cosmic Canine Brew;Pop art meets mysticism in a vibrant, dog-adorned vessel.
/SodaCan_211.png;Canine Cosmic Tapestry;A vibrant pup amid a celestial floral dreamscape.
/SodaCan_212.png;Mystic Canine Canvas 2;A vibrant fusion of art and soul in a whimsical dog portrait.
/SodaCan_213.png;Psychedelic Canine Canvas;Vibrant Frenchie adorns a surreal, floral dreamscape.
/SodaCan_214.png;Mystic Canine Canvas 3;A vibrant, psychedelic portrayal of a dog's spirit.
/SodaCan_215.png;Mystic Canine Canvas 4;A soda can transformed into a tapestry of vibrant tribal dog art.
/SodaCan_216.png;Ethereal Canine Vessel;Mystic gaze from a vibrant vessel.
/SodaCan_217.png;Canine Chroma Quencher;A vibrant blend of artistry and spirit, encapsulated in a whimsical canine vessel.
/SodaCan_218.png;Cosmic Canine Canvas 2;A vivid, cosmic-spaniel fusion, encapsulating the universe's colorful wonder.
/SodaCan_219.png;Cosmic Canine Quench 2;A vibrant, psychedelic pup encapsulates thirst for the extraordinary.
/SodaCan_220.png;Canine Chroma Quench;Vivid hues capture a dog's spirit, canned in psychedelic artistry.
/SodaCan_221.png;Cosmic Canine Quencher;A psychedelic pup in a vibrant, cosmic wrapper, popping with color.
/SodaCan_222.png;Cosmic Canine Canvas 3;An artistic fusion of vibrant cosmos and stoic canine on a sleek canvas.
/SodaCan_223.png;Spectral Spaniel Swirl;A vibrant, psychedelic canine portrait.
/SodaCan_224.png;Cosmic Canine Swirl 1;A vibrant swirl of cosmic hues and canine gaze.
/SodaCan_225.png;Cosmic Canine Swirl 2;A vibrant vortex of doggy dreams captured in psychedelic artistry.
/SodaCan_226.png;Psychedelic Spaniel Swirl;Vivid canine artistry encapsulated.
/SodaCan_227.png;Cosmic Canine Canvas 4;A vibrant, soulful pup encased in psychedelic hues.
/SodaCan_228.png;Floral Raptor Gaze;Eagle spirit enshrined in vibrant bloom.
/SodaCan_229.png;Mystical Canine Cosmos;A vibrant fusion of a pensive pup amidst a psychedelic tapestry of space.
/SodaCan_230.png;Tribal Canine Canvas;Vibrant totem art fused into modern medium.
/SodaCan_231.png;Tribal Canine Spirit;Mystical guardian in vibrant hues, standing timeless in digital folklore.
/SodaCan_232.png;Canine Cosmic Canvas;Enigmatic dog adorned with vibrant cosmic patterns, exuding mystic charm.
/SodaCan_233.png;Mystic Canine Bloom;A vibrant fusion of flora and fauna in a captivating canine silhouette.
/SodaCan_234.png;Ethereal Avian Bloom;Vivid phoenix rebirth on a can.
/SodaCan_235.png;Floral Raptor Essence;Vivid blossoms merge with an eagle's gaze.
/SodaCan_236.png;Vibrant Avian Aegis;A vivid tapestry of nature's guardian, immortalized on aluminum canvas.
/SodaCan_237.png;Avian Bloom Canister;Vibrant eagle adorned with florals, encased in artistry.
/SodaCan_238.png;Blossom Raptor Can;A vibrant fusion of wild flora and avian grace, encased in aluminum art.
/SodaCan_239.png;Ethereal Avian Blossom;Vibrant eagle in floral eden.
/SodaCan_240.png;Fabled Feathered Brew;Vibrant mythic avian graces this unique artisanal can.
/SodaCan_241.png;Vivid Dreamscape Canister;Surreal colors swirl on this mesmerizing, joy-infused art can.
/SodaCan_242.png;Vibrant Avian Majesty;Feathers bloom amidst flora—artistic splendour captured.
/SodaCan_243.png;Vibrant Avian Bloom;Artistic fusion of wildlife and flora on a canvas of aluminum.
/SodaCan_244.png;Mystic Feathered Elixir;Vibrant avian fantasy captured on a mystical can.
/SodaCan_245.png;Floral Raptor Can;Vibrant fusion of wild nature and art.
/SodaCan_246.png;Mystic Dreamcatcher Eagle;Vibrant guardian spirit encased in artistry.
/SodaCan_247.png;Chromatic Avian Aura;Vividly-colored phoenix encapsulating rebirth in art.
/SodaCan_248.png;Mystic Mountain Brew;Elixir of alpine joy.
/SodaCan_249.png;Floral Phoenix Can;Vibrant fusion of nature and myth.
/SodaCan_250.png;Vibrant Avian Essence;A fusion of wildlife and artistry, encapsulated.
/SodaCan_251.png;Psychedelic Avian Elixir;Vibrant feathers bloom: a canned canvas of mystique.
/SodaCan_252.png;Vibrant Avian Elixir 1;A fusion of flora and bird, encapsulating nature's vibrant tapestry.
/SodaCan_253.png;Vibrant Avian Aura;Psychedelic hues encapsulate eagle's fierce spirit.
/SodaCan_254.png;Vibrant Avian Elixir 2;A mystical beverage can adorned with a psychedelic feathered guardian.
/SodaCan_255.png;Mystic Scaled Bloom;A can adorned with a vivid, mythical reptile amidst flourishing blooms.
/SodaCan_256.png;Mythic Serpent Canister 1;Enigmatic totem artistry encased.
/SodaCan_257.png;Psychedelic Lizard Can;Mesmerizing, vibrant lizard art encapsulated in a can.
/SodaCan_258.png;Mythic Serpent Can;Enigmatic serpent draped in tattoo art.
/SodaCan_259.png;Mystic Chameleon Canister;A psychedelic fusion of reptilian mystique in a can.
/SodaCan_260.png;Tattooed Toad Totem;Intricate patterns cloak a mystical amphibian with enigmatic allure.
/SodaCan_261.png;Mythic Draconic Brew;Unleash legendary flavors.
/SodaCan_262.png;Mystical Amphibian Aura;An enchanting totem of frog-inspired artistry and myth.
/SodaCan_263.png;Chromatic Serpent Essence;A mystical serpent adorned in vibrant tattoo artistry.
/SodaCan_264.png;Polar Can Essence;Arctic mystery in aluminum.
/SodaCan_265.png;Mystic Amphibia Enigma;A captivating, otherworldly amphibian shrouded in ornate mystique.
/SodaCan_266.png;Arctic Sentinel Can 3;Majestic polar guardian encapsulated.
/SodaCan_267.png;Arctic Essence Captured 2;Polar bear mystique, enshrined in icy blue.
/SodaCan_268.png;Arctic Sentinel Ale;Majestic bear guards frosty realms, captured on a crisp can canvas.
/SodaCan_269.png;Frost Monarch Canister;Majestic polar sentinel in a frosted realm.
/SodaCan_270.png;Arctic Essence Capsule;A polar cub's frozen sanctuary, encased in time.
/SodaCan_271.png;Arctic Can Guardian;A frosty sentinel emerges, encased in icy aluminum.
/SodaCan_272.png;Arctic Essence Vessel;A polar bear embodied in a can, capturing the frozen wilderness.
/SodaCan_273.png;Mystic Gaze Serpent;A serpent's enigmatic smile, adorned in psychedelic artistry.
/SodaCan_274.png;Chromatic Serpent Aura;Vividly inked energy encased in metal.
/SodaCan_275.png;Chromatic Chameleon Can 1;Vividly tattooed, this chameleon can radiates enigmatic allure.
/SodaCan_276.png;Chromatic Gecko Burst;Vibrant gecko magic encapsulated.
/SodaCan_277.png;Chromatic Chameleon Can 2;A vivid vessel, alive with enchanting reptilian artistry.
/SodaCan_278.png;Chromatic Chameleon Vision;A vivid, artistic chameleon merging nature with fantasy.
/SodaCan_279.png;Mythic Serpent Canister 2;Enchanted serpent-guarded vessel of secrets.
/SodaCan_280.png;Mystic Owl Canister;Enchanting tribal wisdom captured.
/SodaCan_281.png;Mystic Totem Vision;Enigmatic gaze from an intricately patterned artifact.
/SodaCan_282.png;Mystic Gaze Canister 1;Ornate enigma vessel whispers ancient tales.
/SodaCan_283.png;Mystic Canthropus Aura;Enigmatic tribal totem, alive in color.
/SodaCan_284.png;Mystic Visionary Vessel;Enigmatic tribal art dances on a canvas of curves.
/SodaCan_285.png;Mystic Totem Owl;An enigmatic owl totem, adorned with ancient wisdom.
/SodaCan_286.png;Mystic Tribal Sentinel;Vibrant guardianship etched in art.
/SodaCan_287.png;Mystic Totem Canister;Enigmatic vessel of vibrant myths.
/SodaCan_288.png;Mystic Totem Can;Tribal patterns encapsulate spirited folklore.
